{
  "detected_tech_stack": [
    "React",
    "Node.js",
    "Express"
  ],
  "current_architecture": "A monolithic Express backend serving a React frontend from the same repository.",
  "broken_or_incomplete_areas": [
    "Authentication middleware is stubbed out but not implemented.",
    "Database connection string is hardcoded and fails on startup."
  ],
  "risk_hotspots": [
    "No unit tests exist for the payment processing route.",
    "Using outdated versions of several npm packages with known vulnerabilities."
  ]
}
